{
  "$schema": "./contracts/skills-manifest.schema.json",
  "schemaVersion": 1,
  "skillOwner": "KimYx0207",
  "skills": [
    {
      "id": "agent-teams-playbook",
      "repo": "${skillOwner}/agent-teams-playbook",
      "installMethod": "gitCloneInstallScript",
      "targets": [
        "claude",
        "codex",
        "openclaw",
        "cursor"
      ]
    },
    {
      "id": "findskill",
      "repo": "${skillOwner}/findskill",
      "installMethod": "subdirExtraction",
      "subdirTemplate": "{platform}",
      "subdirMapping": {
        "win32": "windows",
        "default": "original"
      },
      "legacyNames": ["find-skills"],
      "targets": [
        "claude",
        "codex",
        "openclaw",
        "cursor"
      ]
    },
    {
      "id": "hookprompt",
      "repo": "${skillOwner}/HookPrompt",
      "installMethod": "manual",
      "hookSubdirs": {
        "claude": [".claude/hooks"]
      },
      "hookExtraFiles": {
        "claude": [
          { "src": ".claude/prompt-optimizer-meta.md", "dest": "prompt-optimizer-meta.md" }
        ]
      },
      "hookSettingsMerge": {
        "claude": {
          "event": "UserPromptSubmit",
          "hookFile": "user-prompt-submit.js",
          "timeout": 10000
        }
      },
      "targets": [
        "claude"
      ]
    },
    {
      "id": "superpowers",
      "repo": "obra/superpowers",
      "claudePlugin": "superpowers@superpowers-marketplace",
      "installMethod": "pluginMarketplace",
      "fallbackContentDir": "skills",
      "targets": [
        "claude",
        "codex",
        "openclaw",
        "cursor",
        "opencode"
      ]
    },
    {
      "id": "everything-claude-code",
      "repo": "affaan-m/everything-claude-code",
      "claudePlugin": "ecc@everything-claude-code",
      "installMethod": "pluginMarketplace",
      "targets": [
        "claude",
        "codex",
        "openclaw",
        "cursor",
        "opencode"
      ]
    },
    {
      "id": "planning-with-files",
      "repo": "OthmanAdi/planning-with-files",
      "installMethod": "subdirExtraction",
      "subdir": "skills/planning-with-files",
      "pluginHookCompat": true,
      "hookSubdirs": {
        "codex": [".codex/hooks"],
        "cursor": [".cursor/hooks"]
      },
      "hookConfigFiles": {
        "codex": ".codex/hooks.json",
        "cursor": ".cursor/hooks.json"
      },
      "targets": [
        "claude",
        "codex",
        "openclaw",
        "cursor"
      ]
    },
    {
      "id": "cli-anything",
      "repo": "HKUDS/CLI-Anything",
      "installMethod": "pluginMarketplace",
      "defaultSelected": false,
      "targets": [
        "claude",
        "codex",
        "openclaw",
        "cursor"
      ]
    },
    {
      "id": "gstack",
      "repo": "garrytan/gstack",
      "installMethod": "gitCloneInstallScript",
      "targets": [
        "claude",
        "codex",
        "openclaw",
        "cursor"
      ]
    },
    {
      "id": "skill-creator",
      "repo": "anthropics/skills",
      "installMethod": "subdirExtraction",
      "subdir": "skills/skill-creator",
      "targets": [
        "claude",
        "codex",
        "openclaw",
        "cursor"
      ]
    }
  ],
  "externalUrls": {
    "claudeCodeDocs": "https://docs.anthropic.com/en/docs/claude-code",
    "author": {
      "website": "https://www.aiking.dev/",
      "github": "https://github.com/KimYx0207",
      "feishu": "https://my.feishu.cn/wiki/OhQ8wqntFihcI1kWVDlcNdpznFf",
      "x": "https://x.com/KimYx0207"
    }
  }
}
